{
  "schema_version": 1,
  "slug": "five-checks-before-sharing-a-chart",
  "title": "Five checks before sharing a chart",
  "lang": "en",
  "format": "slides",
  "pillar": "P1",
  "status": "draft",
  "claims": [],
  "fictional": true,
  "alt": "Five slides listing five checks before sharing a chart."
}
